{
  "$schema": "./workstation-config.schema.json",
  "projectName": "ec2-workstation",
  "environment": "dev",
  "vpcCidr": "10.0.0.0/16",
  "defaultInstanceConfig": {
    "instanceType": "t3.medium",
    "rootVolumeSize": 30,
    "rootVolumeType": "gp3",
    "dataVolumeSize": 40,
    "dataVolumeType": "gp3"
  },
  "autoStopConfig": {
    "cpuThreshold": 3,
    "cpuEvaluationMinutes": 30,
    "scheduledStopHour": 23,
    "scheduledStopMinute": 0
  },
  "enableElasticIp": false,
  "users": [
    {
      "username": "developer1",
      "displayName": "Developer One"
    },
    {
      "username": "developer2",
      "displayName": "Developer Two"
    }
  ]
}
